{
  "schema_version": "1.0",
  "plan_id": "joint-dual-innovation-ten-stage-v1",
  "plan_status": "blocked_not_run",
  "frozen_at_utc": "2026-08-22T02:06:53Z",
  "operating_mode": "evaluation",
  "runtime_policy": {
    "text_model_id": "deepseek-v4-flash",
    "vision_model_id": "glm-4.6v",
    "human_intervention_during_run": false
  },
  "innovation_ledger_reference": {
    "status": "locked",
    "path": "research/innovation-evidence-ledger-v1.json",
    "sha256": "393222efc6076bae342125cf805235f4c916f7a0bce654fb2fed3af1bc82fa04"
  },
  "lifecycle_stages": [
    {"ordinal": 0, "stage_id": "topic_feasibility", "receipt_required": true},
    {"ordinal": 1, "stage_id": "protocol_registration", "receipt_required": true},
    {"ordinal": 2, "stage_id": "search_retrieval", "receipt_required": true},
    {"ordinal": 3, "stage_id": "selection", "receipt_required": true},
    {"ordinal": 4, "stage_id": "data_lineage", "receipt_required": true},
    {"ordinal": 5, "stage_id": "appraisal", "receipt_required": true},
    {"ordinal": 6, "stage_id": "freeze_synthesis", "receipt_required": true},
    {"ordinal": 7, "stage_id": "certainty_interpretation", "receipt_required": true},
    {"ordinal": 8, "stage_id": "reporting_review", "receipt_required": true},
    {"ordinal": 9, "stage_id": "living_update", "receipt_required": true}
  ],
  "seeds": [20260820, 20260821, 20260822],
  "topic_protocol_inputs": [
    {
      "binding_id": "temporal_evidence_landscape",
      "status": "missing",
      "path": null,
      "sha256": null,
      "protocol_role": "stage_0_frozen_input"
    },
    {
      "binding_id": "topic_generation_protocol",
      "status": "missing",
      "path": null,
      "sha256": null,
      "protocol_role": "stage_0_frozen_input"
    },
    {
      "binding_id": "topic_signal_audit_protocol",
      "status": "missing",
      "path": null,
      "sha256": null,
      "protocol_role": "stage_0_frozen_input"
    },
    {
      "binding_id": "topic_scoring_protocol",
      "status": "missing",
      "path": null,
      "sha256": null,
      "protocol_role": "stage_0_frozen_input"
    }
  ],
  "mechanism_bindings": [
    {
      "binding_id": "topic_candidate_generator",
      "cli": {
        "status": "locked",
        "path": "metawingman/scripts/propose_topics.py",
        "sha256": "2b263c0ac104beb6ca440aa55374441d4cc1cd225477c9ea9a07deeb868f0e56"
      },
      "implementation": {
        "status": "locked",
        "path": "metawingman/scripts/metawingman_core/topic_proposer.py",
        "sha256": "a62a30e735ecb4ff1580175e548331d042bfeec79af7dd6aa389e7d4f90edddf"
      },
      "command_template": [
        "python",
        "metawingman/scripts/propose_topics.py",
        "{landscape}",
        "--provider-config",
        "{provider_config}",
        "--max-proposals",
        "{candidate_budget}",
        "--allow-hosted-data-transfer",
        "--out",
        "{proposal_batch}"
      ]
    },
    {
      "binding_id": "topic_opportunity_controller",
      "cli": {
        "status": "locked",
        "path": "metawingman/scripts/select_topics.py",
        "sha256": "b72eb69d054395be6177d55b4a2fe7bb3cd454bf6300f6be06fc0ded633f23ce"
      },
      "implementation": {
        "status": "locked",
        "path": "metawingman/scripts/metawingman_core/topic_opportunity.py",
        "sha256": "a36f72c46f1911fb870253b157ac1aacea1732159a82cb1231cc4213129a76c0"
      },
      "command_template": [
        "python",
        "metawingman/scripts/select_topics.py",
        "{landscape}",
        "{candidate_set}",
        "--out",
        "{topic_decision}"
      ]
    },
    {
      "binding_id": "conclusion_risk_impact_controller",
      "cli": {
        "status": "locked",
        "path": "metawingman/scripts/run_evidence_acquisition_loop.py",
        "sha256": "a4aa496aeb3d5a59e90030e235e890e4d4ab26fb4407e1af5023f5407d23c8ec"
      },
      "implementation": {
        "status": "locked",
        "path": "metawingman/scripts/metawingman_core/evidence_acquisition_loop.py",
        "sha256": "4f237447a23b0ba397b27a2f25924c09c15bd9732af004c47cefa738db18299e"
      },
      "command_template": [
        "python",
        "metawingman/scripts/run_evidence_acquisition_loop.py",
        "{initial_evidence_acquisition_state}",
        "{loop_plan}",
        "--executor",
        "{executor_module_function}",
        "--created-at-utc",
        "{created_at_utc}",
        "--out",
        "{loop_result}"
      ]
    }
  ],
  "scientific_prerequisites": [
    {
      "prerequisite_id": "topic_signal_construct_validity",
      "status": "blocked",
      "basis": "Decision relevance, source-family, cross-domain, uncertainty, contamination, and known-item signals require independent construct repair and calibration before confirmatory use.",
      "required_for": "both"
    },
    {
      "prerequisite_id": "independent_false_opportunity_labels",
      "status": "blocked",
      "basis": "Current false-opportunity labels are not independent of the full policy gates and cannot validate specificity.",
      "required_for": "confirmatory_claim"
    },
    {
      "prerequisite_id": "direct_generic_candidate_generation_baseline",
      "status": "blocked",
      "basis": "Existing controls rerank one shared candidate set; an independently generated generic comparator does not yet have a frozen executable runner.",
      "required_for": "both"
    },
    {
      "prerequisite_id": "joint_ten_stage_runner",
      "status": "blocked",
      "basis": "No runner currently executes both innovations on one case through all ten lifecycle stages.",
      "required_for": "both"
    },
    {
      "prerequisite_id": "new_confirmatory_family_freeze",
      "status": "blocked",
      "basis": "The one previously used Lancet family is a one-time component diagnostic and cannot be reused as a new confirmatory held-out family; at least two new authoritative representative families must be frozen after method lock.",
      "required_for": "both"
    },
    {
      "prerequisite_id": "historical_model_memory_boundary",
      "status": "blocked",
      "basis": "Historical target memorization cannot yet be excluded for the fixed hosted model; claims must remain agreement-with-reference unless prospective or memory-bounded cases are used.",
      "required_for": "confirmatory_claim"
    },
    {
      "prerequisite_id": "risk_impact_controller_direct_evaluation",
      "status": "blocked",
      "basis": "The hash-bound action-execute-replan loop is fixture-tested and uses metawingman/scripts/metawingman_core/evidence_acquisition.py as its supporting single-step planner, but no case-specific scientific executor adapter or direct held-out run exists; the earlier negative result tested only an axis-prompt proxy.",
      "required_for": "both"
    },
    {
      "prerequisite_id": "case_material_version_binding",
      "status": "blocked",
      "basis": "No confirmatory case currently has one cutoff-bound corpus, workbook, article, and conclusion reference graph with real hashes.",
      "required_for": "execution"
    },
    {
      "prerequisite_id": "checkpoint_and_family_closure",
      "status": "blocked",
      "basis": "Seed-specific checkpoint lineage and review-family dependency closure have not been locked.",
      "required_for": "execution"
    }
  ],
  "evaluation_design": {
    "design": "two_by_two_joint_factorial",
    "candidate_comparison_scope": "direct_candidate_generation_per_arm",
    "shared_candidate_reranking_only_prohibited": true,
    "matched_budget": {
      "budget_id": "joint-matched-budget-v1",
      "status": "unfrozen",
      "max_provider_calls": null,
      "max_input_tokens": null,
      "max_output_tokens": null,
      "wall_seconds": null,
      "cost_reporting": "known_value_or_explicit_unknown_never_imputed_zero"
    },
    "arms": [
      {
        "arm_id": "generic-topic__fixed-acquisition",
        "topic_opportunity_control": false,
        "conclusion_risk_impact_control": false,
        "candidate_generation_mode": "generic_direct_generation",
        "acquisition_mode": "fixed_generic",
        "runner_binding": {"status": "missing", "path": null, "sha256": null},
        "resource_usage": {
          "provider_calls": {"status": "not_run", "value": null},
          "input_tokens": {"status": "not_run", "value": null},
          "output_tokens": {"status": "not_run", "value": null},
          "wall_seconds": {"status": "not_run", "value": null},
          "cost": {"status": "not_run", "value": null, "currency": null}
        }
      },
      {
        "arm_id": "decision-topic__fixed-acquisition",
        "topic_opportunity_control": true,
        "conclusion_risk_impact_control": false,
        "candidate_generation_mode": "decision_aware_direct_generation",
        "acquisition_mode": "fixed_generic",
        "runner_binding": {"status": "missing", "path": null, "sha256": null},
        "resource_usage": {
          "provider_calls": {"status": "not_run", "value": null},
          "input_tokens": {"status": "not_run", "value": null},
          "output_tokens": {"status": "not_run", "value": null},
          "wall_seconds": {"status": "not_run", "value": null},
          "cost": {"status": "not_run", "value": null, "currency": null}
        }
      },
      {
        "arm_id": "generic-topic__risk-impact-acquisition",
        "topic_opportunity_control": false,
        "conclusion_risk_impact_control": true,
        "candidate_generation_mode": "generic_direct_generation",
        "acquisition_mode": "risk_times_impact",
        "runner_binding": {"status": "missing", "path": null, "sha256": null},
        "resource_usage": {
          "provider_calls": {"status": "not_run", "value": null},
          "input_tokens": {"status": "not_run", "value": null},
          "output_tokens": {"status": "not_run", "value": null},
          "wall_seconds": {"status": "not_run", "value": null},